{
  "$schema": "https://json-schema.org/draft/2020-12/schema",
  "$id": "https://github.com/Arshu-1104/RMIC/schema/contract.schema.json",
  "title": "RMIC Identity Contract",
  "description": "Schema for an RMIC-Guard identity contract, both unsealed (author-time) and sealed (contract_hash + anchor_embedding present) forms. This is the authoritative reference for core.validation.validate_contract_dict.",
  "type": "object",
  "required": ["agent_id", "role_name", "sector", "semantic_anchors"],
  "additionalProperties": true,
  "properties": {
    "agent_id": {
      "type": "string",
      "minLength": 1,
      "description": "Stable machine identifier for the agent this contract governs."
    },
    "role_name": {
      "type": "string",
      "minLength": 1,
      "description": "Human-readable role name, e.g. 'Research Agent'."
    },
    "sector": {
      "type": "string",
      "minLength": 1,
      "description": "Domain/sector this agent operates in, e.g. 'research', 'finance', 'healthcare'."
    },
    "role_description": {
      "type": "string",
      "description": "Optional free-text description of the role.",
      "default": ""
    },
    "semantic_anchors": {
      "type": "array",
      "minItems": 1,
      "items": { "type": "string", "minLength": 1 },
      "description": "First-person sentences describing what the agent does. Embedded once at seal time into anchor_embedding; used at runtime to measure role_distance."
    },
    "allowed_actions": {
      "type": "array",
      "items": { "type": "string" },
      "default": [],
      "description": "Exact tool names this contract permits. Empty list means no allow-list restriction (only forbidden_actions applies)."
    },
    "forbidden_actions": {
      "type": "array",
      "items": { "type": "string" },
      "default": [],
      "description": "Exact tool names that are always blocked, regardless of allowed_actions."
    },
    "data_scope": {
      "type": "object",
      "default": {},
      "additionalProperties": false,
      "properties": {
        "accessible": { "type": "array", "items": { "type": "string" } },
        "prohibited": { "type": "array", "items": { "type": "string" } },
        "pii_categories": { "type": "array", "items": { "type": "string" } }
      },
      "description": "Data categories the agent may/may not touch. 'prohibited' is enforced by the hard-rule pass."
    },
    "parameter_constraints": {
      "type": "object",
      "default": {},
      "additionalProperties": {
        "type": "object",
        "properties": {
          "min": { "type": "number" },
          "max": { "type": "number" },
          "type": { "type": "string", "enum": ["float", "int"] },
          "confirm_above": {
            "type": "number",
            "description": "Values above this (and not above max) return NEEDS_CONFIRMATION: the tool is not executed until guard.confirm(confirmation_id). Must be >= min and < max."
          }
        }
      },
      "description": "Numeric bounds per tool-call argument name, e.g. {\"amount\": {\"min\": 0, \"max\": 50000, \"confirm_above\": 10000, \"type\": \"float\"}}."
    },
    "argument_rules": {
      "type": "object",
      "minProperties": 1,
      "description": "Per-tool argument rules (tool names matched like allowed_actions, case-insensitively). An argument not in allowed_args BLOCKs with argument_not_allowed:<tool>:<arg>; a value that does not full-match its pattern BLOCKs with argument_pattern:<tool>:<arg>. Patterns apply to strings and numbers (matched by their decimal form) and to every element of a list of them; any other type (bool, null, object), or a value longer than max_length, fails. Regexes are compiled when the contract is loaded (invalid ones are rejected) and limited to 500 characters.",
      "additionalProperties": {
        "type": "object",
        "additionalProperties": false,
        "minProperties": 1,
        "properties": {
          "allowed_args": { "type": "array", "items": { "type": "string", "minLength": 1 }, "uniqueItems": true },
          "patterns": {
            "type": "object", "minProperties": 1,
            "additionalProperties": { "type": "string", "minLength": 1, "maxLength": 500 }
          },
          "max_length": { "type": "integer", "minimum": 1, "default": 1024 }
        }
      }
    },
    "deny_patterns": {
      "type": "object",
      "minProperties": 1,
      "additionalProperties": false,
      "anyOf": [{ "required": ["packs"] }, { "required": ["custom"] }, { "required": ["prohibited_terms"] }],
      "description": "Opt-in heuristics matched against the end user's message only (case-insensitive search). HEURISTICS: they catch explicit wording and are evaded by rewording. BLOCK reasons are deny_pattern:<pack>:<pattern_id>; action 'warn' lets the call proceed and reports the match in GuardResult.warnings.",
      "properties": {
        "packs": {
          "type": "array", "minItems": 1,
          "items": {
            "oneOf": [
              { "type": "string", "enum": ["role_reassignment", "objective_override", "guardrail_removal"] },
              {
                "type": "object", "required": ["name"], "additionalProperties": false,
                "properties": {
                  "name": { "type": "string", "enum": ["role_reassignment", "objective_override", "guardrail_removal"] },
                  "action": { "type": "string", "enum": ["block", "warn"], "default": "block" }
                }
              }
            ]
          }
        },
        "custom": {
          "type": "array", "minItems": 1,
          "items": {
            "type": "object", "required": ["id", "regex"], "additionalProperties": false,
            "properties": {
              "id": { "type": "string", "pattern": "^[a-z0-9_]{1,64}$" },
              "regex": { "type": "string", "minLength": 1, "maxLength": 500 },
              "action": { "type": "string", "enum": ["block", "warn"], "default": "block" }
            }
          }
        },
        "prohibited_terms": {
          "type": "object", "required": ["terms"], "additionalProperties": false,
          "description": "Words or phrases matched whole-word, case-insensitively (whitespace inside a phrase matches any whitespace). pattern_id = the term lower-cased with non-alphanumerics replaced by _.",
          "properties": {
            "terms": { "type": "array", "minItems": 1, "items": { "type": "string", "minLength": 1, "maxLength": 200 } },
            "action": { "type": "string", "enum": ["block", "warn"], "default": "block" }
          }
        },
        "max_scan_chars": {
          "type": "integer", "minimum": 1, "default": 10000,
          "description": "Only the first max_scan_chars characters of the user message are scanned. A longer message is still scanned up to that point and the result carries the warning deny_pattern_scan_truncated:<max_scan_chars>."
        }
      }
    },
    "confirmation_ttl_seconds": {
      "type": "number", "exclusiveMinimum": 0, "default": 600,
      "description": "Seconds a NEEDS_CONFIRMATION id stays valid; guard.confirm() of an older id fails (reason 'expired') and is audited. Guard(confirmation_ttl_seconds=...) overrides it."
    },
    "ids_warn_threshold": {
      "type": "number", "minimum": 0.0, "maximum": 1.0, "default": 0.35,
      "description": "IDS score at/above which a WARN + re-anchoring recovery is triggered."
    },
    "ids_block_threshold": {
      "type": "number", "minimum": 0.0, "maximum": 1.0, "default": 0.60,
      "description": "IDS score at/above which the planned tool call is BLOCKed. Must be >= ids_warn_threshold."
    },
    "drift_velocity_threshold": {
      "type": "number", "minimum": 0.0, "default": 0.05,
      "description": "Step-to-step IDS delta above which a PREEMPTIVE_WARN is raised even while below ids_warn_threshold."
    },
    "recovery_policy": {
      "type": "string", "default": "re-anchor",
      "description": "Recovery strategy identifier consumed by core.recovery_engine."
    },
    "compliance_tags": {
      "type": "array", "items": { "type": "string" }, "default": [],
      "description": "Free-form compliance/regulatory tags, e.g. ['HIPAA', 'SOC2']."
    },
    "contract_version": {
      "type": "string", "pattern": "^\\d+\\.\\d+\\.\\d+$", "default": "1.0.0",
      "description": "Semantic version of this contract instance."
    },
    "created_at": {
      "type": "string", "format": "date-time",
      "description": "ISO-8601 timestamp. Set automatically at seal time if omitted."
    },
    "contract_hash": {
      "type": "string", "pattern": "^[0-9a-f]{64}$",
      "description": "SHA-256 hex digest over every other field (sorted, canonical JSON). Present only once sealed."
    },
    "anchor_embedding": {
      "type": "array", "items": { "type": "number" },
      "description": "L2-normalised mean embedding of semantic_anchors. Present only once sealed."
    }
  }
}
