{
  "agent_id": "financial_agent",
  "role_name": "Financial Transfer Agent",
  "sector": "finance",
  "role_description": "An autonomous financial agent that processes bank transfer requests and provides financial analysis within approved limits. Operates without human intervention across 24/7 automated banking workflows.",
  "semantic_anchors": [
    "I process authorised financial transfer requests and provide financial analysis using approved internal documents.",
    "I access only the transaction data and account balances required to process the specific request being made.",
    "I do not create accounts, modify permissions, access administrative functions, or approve transfers above my limit.",
    "I decline any request that exceeds my authorised limit or references accounts outside my operational scope.",
    "I operate fully autonomously and do not accept verbal or written overrides to my transaction limits."
  ],
  "allowed_actions": [
    "transfer_funds",
    "check_balance",
    "get_transaction_history",
    "send_transfer_confirmation"
  ],
  "forbidden_actions": [
    "give_investment_advice",
    "share_customer_pii",
    "perform_account_transactions",
    "execute_code",
    "create_account",
    "delete_account",
    "modify_permissions",
    "admin_login",
    "bulk_transfer",
    "override_limit"
  ],
  "data_scope": {
    "accessible": [
      "transaction_amount",
      "recipient_account",
      "sender_balance",
      "transaction_timestamp"
    ],
    "prohibited": [
      "account_passwords",
      "credit_scores",
      "personal_address",
      "tax_records",
      "other_customer_data"
    ],
    "pii_categories": [
      "account_number",
      "transaction_history"
    ]
  },
  "parameter_constraints": {
    "amount": {
      "max": 50000.0,
      "min": 0.01,
      "type": "float",
      "confirm_above": 10000.0
    }
  },
  "ids_warn_threshold": 0.35,
  "ids_block_threshold": 0.6,
  "drift_velocity_threshold": 0.05,
  "recovery_policy": "re-anchor",
  "compliance_tags": [
    "DPDP",
    "RBI_Guidelines",
    "PCI_DSS"
  ],
  "contract_version": "1.1.0",
  "created_at": "2026-04-04T07:19:08.647801+00:00",
  "anchor_embedding": [
    0.011368407867848873,
    -0.024885619059205055,
    -0.007387050427496433,
    -0.050191909074783325,
    -0.009745310992002487,
    -0.08331593126058578,
    0.1263679563999176,
    -0.011041859164834023,
    0.05156814679503441,
    -0.018618067726492882,
    0.0020192633382976055,
    0.005896057467907667,
    0.017763616517186165,
    0.017862237989902496,
    -0.016230156645178795,
    -0.016854755580425262,
    0.03717990219593048,
    -0.06165468320250511,
    -0.06946961581707001,
    0.05500305816531181,
    -0.009945721365511417,
    -0.02375767007470131,
    -0.009681659750640392,
    -0.02427070029079914,
    0.0012017955305054784,
    -0.01652817614376545,
    -0.03198465704917908,
    -0.010847697965800762,
    -0.0855666771531105,
    -0.1053323969244957,
    0.023088233545422554,
    -0.056474097073078156,
    -0.06864269822835922,
    -0.0016100368229672313,
    0.05538003146648407,
    0.016851140186190605,
    -0.03280365467071533,
    -0.023050351068377495,
    -0.010464307852089405,
    0.01826532557606697,
    0.05510659143328667,
    0.035333093255758286,
    -0.011321673169732094,
    0.0003583970828913152,
    0.02093711867928505,
    -0.07952947169542313,
    0.020463453605771065,
    0.017022309824824333,
    0.055385466665029526,
    0.04560765251517296,
    0.0038289891090244055,
    0.009470993652939796,
    0.0151598509401083,
    0.07557505369186401,
    -0.0176781564950943,
    0.02640490047633648,
    0.04623589292168617,
    0.05245821177959442,
    0.02803693525493145,
    0.02619311586022377,
    0.0007524795946665108,
    0.04927973076701164,
    -0.11791230738162994,
    0.03270770609378815,
    -0.01721443422138691,
    0.07495838403701782,
    0.02041737735271454,
    -0.02651863731443882,
    0.004903167951852083,
    0.010819841176271439,
    0.045307520776987076,
    -0.021404067054390907,
    -0.047595761716365814,
    0.0706573948264122,
    0.009440585970878601,
    -0.037542663514614105,
    -0.003761823056265712,
    0.052335649728775024,
    -0.025096271187067032,
    0.03415261581540108,
    -0.015016596764326096,
    -0.06330191344022751,
    -0.013003452681005001,
    0.013995193876326084,
    -0.06659793108701706,
    0.018134236335754395,
    0.0090432558208704,
    0.019989265128970146,
    0.01454172097146511,
    0.012758281081914902,
    0.031202811747789383,
    -0.05677444860339165,
    0.08329988270998001,
    0.02437027357518673,
    -0.007279489655047655,
    -0.034180644899606705,
    0.03232453018426895,
    0.03761499747633934,
    -0.06795420497655869,
    0.37604013085365295,
    0.033639904111623764,
    0.00163678964599967,
    0.004220383241772652,
    0.019736958667635918,
    -0.031054159626364708,
    0.039163604378700256,
    0.005179313477128744,
    -0.010420828126370907,
    -0.021328868344426155,
    -0.04419555887579918,
    -0.0501287579536438,
    -0.015181707218289375,
    0.05500372499227524,
    0.01055377908051014,
    -0.02339877374470234,
    0.08885553479194641,
    -0.039560895413160324,
    0.03188028931617737,
    -0.036017272621393204,
    -0.05783127620816231,
    -0.0007479310734197497,
    0.04388981685042381,
    0.014197914861142635,
    0.048027463257312775,
    -0.05373029783368111,
    -0.013108711689710617,
    0.08397668600082397,
    0.057184264063835144,
    -0.015301866456866264,
    0.05044944956898689,
    0.018968835473060608,
    -0.09043703973293304,
    -0.06027771532535553,
    -0.03574949502944946,
    0.02092813514173031,
    -0.012620829977095127,
    -0.013485351577401161,
    0.026548627763986588,
    0.09819534420967102,
    0.009811119176447392,
    -0.07240284234285355,
    -0.007434423081576824,
    -0.05916789546608925,
    -0.044787175953388214,
    0.028637047857046127,
    0.08524387329816818,
    0.043127961456775665,
    0.03429945558309555,
    0.04195558279752731,
    -0.05512581765651703,
    0.020920036360621452,
    0.030958758667111397,
    0.02171541005373001,
    -0.0836590901017189,
    -0.016699062660336494,
    -0.004764992743730545,
    0.04390431195497513,
    0.028469635173678398,
    -0.03590131551027298,
    0.01074291206896305,
    0.009302475489675999,
    -0.0200749933719635,
    -0.0029841549694538116,
    0.07607325911521912,
    -0.0065149166621267796,
    -0.09302334487438202,
    -0.0021967582870274782,
    0.034526560455560684,
    -0.016002507880330086,
    0.07122860848903656,
    0.011290909722447395,
    -0.01829073578119278,
    -0.04043233022093773,
    -0.013815289363265038,
    0.14549976587295532,
    -0.056722283363342285,
    -0.05363493412733078,
    0.040341369807720184,
    -0.07013260573148727,
    0.03808116912841797,
    -0.05685637146234512,
    -0.0744132325053215,
    -0.001478973077610135,
    0.005790438037365675,
    0.015547258779406548,
    0.002927635796368122,
    -0.04657899588346481,
    -0.008730058558285236,
    0.01751207746565342,
    -0.05757254362106323,
    -0.07299377769231796,
    0.0530666746199131,
    -0.08710829168558121,
    -0.03066856972873211,
    -0.03840460628271103,
    -0.035229526460170746,
    0.055812083184719086,
    0.028696227818727493,
    -0.05011306330561638,
    -0.001646916731260717,
    0.06361456960439682,
    0.05334405601024628,
    0.01661043055355549,
    0.07097900658845901,
    0.038748472929000854,
    0.05351985991001129,
    -0.03408203274011612,
    -0.0009223453234881163,
    0.06243410333991051,
    0.01914709433913231,
    -0.00692646624520421,
    -0.008048482239246368,
    0.06053059175610542,
    0.021815955638885498,
    0.004737588576972485,
    -0.027247846126556396,
    0.03567713126540184,
    0.047507766634225845,
    0.01546165905892849,
    -0.03678920492529869,
    0.005244889296591282,
    0.038613129407167435,
    0.02063380554318428,
    -0.3089221715927124,
    0.002200504532083869,
    -0.0438380241394043,
    0.0032367720268666744,
    -0.008824949152767658,
    -0.05101034417748451,
    0.0433146208524704,
    -0.03101528063416481,
    -0.06012238934636116,
    0.0556306317448616,
    0.07546769082546234,
    0.016495395451784134,
    -0.016684548929333687,
    0.007240843493491411,
    0.012977929785847664,
    -0.01075374148786068,
    -0.07576427608728409,
    0.056332629173994064,
    -0.022736236453056335,
    0.03098517656326294,
    -0.009247002191841602,
    -0.03640993684530258,
    -0.0026358147151768208,
    -0.024336010217666626,
    0.027957389131188393,
    0.04998967796564102,
    0.16778306663036346,
    -0.07306717336177826,
    0.012215427123010159,
    -0.0010385507484897971,
    0.053650811314582825,
    -0.01728389412164688,
    -0.005465168971568346,
    -0.13361723721027374,
    0.01933436468243599,
    0.03314179554581642,
    -0.07804940640926361,
    0.01923341490328312,
    0.07181677222251892,
    -0.006573716644197702,
    -0.04211605340242386,
    -0.013673326931893826,
    -0.015308812260627747,
    -0.056747350841760635,
    -0.015509371645748615,
    -0.011526288464665413,
    -0.061868634074926376,
    -0.014016471803188324,
    -0.05838799104094505,
    -0.015345385298132896,
    -0.005322465673089027,
    -0.02908032387495041,
    -0.012798364274203777,
    0.0606812909245491,
    0.04017307609319687,
    -0.06140963360667229,
    -0.03690628707408905,
    0.01833013817667961,
    -0.044326599687337875,
    0.062958724796772,
    -0.014602667652070522,
    -0.04037453979253769,
    0.016590669751167297,
    0.006245002616196871,
    0.008172783069312572,
    -0.013318602927029133,
    -0.045947082340717316,
    0.04104531183838844,
    -0.017221231013536453,
    0.0026774920988827944,
    -0.033877406269311905,
    0.015640804544091225,
    0.011845692060887814,
    -0.03806227073073387,
    -0.013449153862893581,
    0.016864748671650887,